{
  "$schema": "https://json-schema.org/draft/2020-12/schema",
  "$id": "stance",
  "title": "Curated stance (matrix cell)",
  "type": "object",
  "additionalProperties": false,
  "required": [
    "candidate",
    "topic",
    "stance",
    "summary",
    "citations",
    "updated_date"
  ],
  "properties": {
    "candidate": {
      "type": "string",
      "pattern": "^[a-z0-9-]+$"
    },
    "topic": {
      "type": "string",
      "pattern": "^[a-z0-9-]+$"
    },
    "stance": {
      "type": "string",
      "enum": [
        "supports",
        "supports-with-conditions",
        "opposes",
        "mixed",
        "no-position"
      ]
    },
    "summary": {
      "type": "string",
      "minLength": 1
    },
    "citations": {
      "type": "array",
      "minItems": 1,
      "items": {
        "type": "string",
        "minLength": 1
      }
    },
    "updated_date": {
      "type": "string",
      "pattern": "^\\d{4}-\\d{2}-\\d{2}$"
    },
    "record": {
      "description": "What the candidate actually DID on this topic while in office \u2014 wins and losses alike. Separate from `stance`, which is their position: a champion of a measure that was defeated still `supports` it. Optional; populated for officeholders.",
      "type": "array",
      "items": {
        "type": "object",
        "additionalProperties": false,
        "required": [
          "action",
          "outcome",
          "citations"
        ],
        "properties": {
          "action": {
            "type": "string",
            "minLength": 1
          },
          "outcome": {
            "type": "string",
            "enum": [
              "enacted",
              "failed",
              "stalled",
              "pending",
              "withdrawn"
            ]
          },
          "date": {
            "type": [
              "string",
              "null"
            ]
          },
          "citations": {
            "type": "array",
            "minItems": 1,
            "items": {
              "type": "string",
              "minLength": 1
            }
          }
        }
      }
    },
    "mechanism": {
      "description": "Denormalized from the cited statement, like `summary`. null when that statement named no mechanism; absent when not yet assessed.",
      "type": [
        "string",
        "null"
      ]
    }
  }
}
