{
  "candidate": "brandon-johnson",
  "topic": "zoning-reform",
  "stance": "supports-with-conditions",
  "summary": "Johnson supports development but calls for a moratorium on new data centers and has signed an executive order to strengthen regulatory processes to ensure community interests are prioritized.",
  "citations": [
    "2026-08-18-block-club-chicago-mayor-s-support-for-quantum-campus-irks-some-south-siders-shut-it-down#1"
  ],
  "updated_date": "2026-08-18"
}
