{
  "candidate": "matthew-brewer",
  "topic": "zoning-reform",
  "stance": "supports",
  "summary": "Supports sensible zoning to make it easier to build housing and convert buildings.",
  "citations": [
    "2026-09-01-the-real-deal-brewer-wants-to-build-more-re-envision-downtown-in-mayoral-bid#2"
  ],
  "updated_date": "2026-09-01",
  "mechanism": null
}
