{
  "candidate": "george-cardenas",
  "topic": "homelessness",
  "stance": "supports",
  "summary": "Describes an integrated strategy that treats homelessness as part of the housing system.",
  "citations": [
    "2026-06-16-cardenas-for-chicago-economic-growth-housing-cardenas-for-chicago#5"
  ],
  "updated_date": "2026-07-09",
  "mechanism": null
}
