{
  "candidate": "brandon-johnson",
  "topic": "affordable-housing-funding",
  "stance": "supports",
  "summary": "Will waive fees for new affordable housing buildings and fast-track zoning and building approvals.",
  "citations": [
    "2026-07-09-brandon-johnson-for-chicago-affordable-housing#2"
  ],
  "updated_date": "2026-07-09",
  "mechanism": "waive fees for new affordable housing buildings and fast-track zoning and building approvals"
}
