{
  "candidate": "george-cardenas",
  "topic": "tenant-protections",
  "stance": "supports",
  "summary": "Supports expanding anti-displacement support including legal aid, rental help and preservation funds, paired with anti-displacement safeguards on as-of-right growth.",
  "citations": [
    "2026-06-16-cardenas-for-chicago-economic-growth-housing-cardenas-for-chicago#4",
    "2026-08-31-the-real-deal-george-cardenas-would-redirect-tifs-as-chicago-mayor#3"
  ],
  "updated_date": "2026-09-01",
  "mechanism": "legal aid, rental help, and preservation funds"
}
