{
  "candidate": "joe-holberg",
  "topic": "property-taxes-tif",
  "stance": "supports",
  "summary": "Argues that building 100,000 housing units will generate $300 million in new property tax revenue, allowing taxes to be lowered.",
  "citations": [
    "2026-07-09-joe-holberg-for-mayor-our-vision-for-chicago#3",
    "2026-08-31-wbez-in-the-loop-with-sasha-ann-simons-ask-the-mayoral-candidate-joe-holberg#2"
  ],
  "updated_date": "2026-09-02",
  "mechanism": "generating $300 million in additional property taxes from 100,000 new units"
}
