{
  "candidate": "brandon-johnson",
  "topic": "property-taxes-tif",
  "stance": "supports",
  "summary": "Will push for rent stabilization with property tax abatements.",
  "citations": [
    "2026-07-09-brandon-johnson-for-chicago-affordable-housing#14"
  ],
  "updated_date": "2026-07-09",
  "mechanism": "property tax abatements"
}
