{
  "candidate": "susana-mendoza",
  "topic": "public-housing-cha",
  "stance": "no-position",
  "summary": "Criticizes the mayor for not filling leadership positions at the CHA but does not state her own policy on public housing.",
  "citations": [
    "2026-07-09-dts-podtrac-com-https-dts-podtrac-com-redirect-mp3-dovetail-prxu-org-12963-25aa6c52-3a#1"
  ],
  "updated_date": "2026-07-09"
}
