{
  "candidate": "joe-holberg",
  "topic": "tenant-protections",
  "stance": "supports",
  "summary": "Aims to ensure residents are not displaced from their neighborhoods.",
  "citations": [
    "2026-07-09-joe-holberg-for-mayor-our-vision-for-chicago#1"
  ],
  "updated_date": "2026-07-09",
  "mechanism": null
}
