{
  "candidate": "lisa-nee",
  "topic": "zoning-reform",
  "stance": "supports",
  "summary": "Supports building housing near CTA to utilize public transportation.",
  "citations": [
    "2026-07-07-wgn-news-dr-lisa-nee-enters-the-race-for-chicago-mayor-the-point#1"
  ],
  "updated_date": "2026-09-02",
  "mechanism": null
}
