{
  "candidate": "joe-holberg",
  "topic": "zoning-reform",
  "stance": "supports",
  "summary": "Proposes building housing on city-owned vacant lots, implying zoning changes to allow 4-6 units per lot.",
  "citations": [
    "2026-07-09-joe-holberg-for-mayor-our-vision-for-chicago#1",
    "2026-08-31-wbez-in-the-loop-with-sasha-ann-simons-ask-the-mayoral-candidate-joe-holberg#1"
  ],
  "updated_date": "2026-09-02",
  "mechanism": "building four or six units on each of 10,000 city-owned vacant lots"
}
