{
  "candidate": "alexi-giannoulias",
  "topic": "affordable-housing-funding",
  "stance": "supports",
  "summary": "Calls for construction of housing that working Chicagoans can afford.",
  "citations": [
    "2026-08-02-wttw-news-backed-by-trade-unions-alexi-giannoulias-launches-campaign-for-chicago#0",
    "2026-08-02-cbs-news-chicago-illinois-secretary-of-state-alexi-giannoulias-announces-campaign-for-c#0"
  ],
  "updated_date": "2026-09-01",
  "mechanism": null
}
