{
  "candidate": "george-cardenas",
  "topic": "permitting-reform",
  "stance": "supports",
  "summary": "Supports accelerating permitting with accountable timelines.",
  "citations": [
    "2026-06-16-cardenas-for-chicago-economic-growth-housing-cardenas-for-chicago#2"
  ],
  "updated_date": "2026-07-09",
  "mechanism": null
}
