{
  "candidate": "george-cardenas",
  "topic": "affordable-housing-funding",
  "stance": "supports",
  "summary": "Supports prioritizing deeply affordable housing pipeline delivery.",
  "citations": [
    "2026-06-16-cardenas-for-chicago-economic-growth-housing-cardenas-for-chicago#3"
  ],
  "updated_date": "2026-07-09",
  "mechanism": null
}
