{
  "candidate": "matthew-brewer",
  "topic": "affordable-housing-funding",
  "stance": "supports",
  "summary": "Supports leveraging federal resources and bringing private and nonprofit capital to address affordable housing shortage.",
  "citations": [
    "2026-06-25-cbs-news-chicago-matt-brewer-former-chair-of-chicago-housing-authority-running-for-chicago-mayor#0",
    "2026-06-24-the-fran-spielman-show-matthew-brewer#0",
    "2026-09-01-the-real-deal-brewer-wants-to-build-more-re-envision-downtown-in-mayoral-bid#0"
  ],
  "updated_date": "2026-09-01",
  "mechanism": null
}
