{
  "candidate": "george-cardenas",
  "topic": "property-taxes-tif",
  "stance": "supports",
  "summary": "Supports an income-indexed property tax circuit breaker, extended to renters, plus a transparent, evidence-driven assessment framework.",
  "citations": [
    "2024-08-06-chicago-sun-times-circuit-breakers-would-ease-burden-of-soaring-cook-county-property-tax#0",
    "2026-08-31-the-real-deal-george-cardenas-would-redirect-tifs-as-chicago-mayor#9",
    "2024-08-06-chicago-sun-times-circuit-breakers-would-ease-burden-of-soaring-cook-county-property-tax#1",
    "2025-07-29-crain-s-chicago-business-chicago-must-be-honest-about-taxes-spending#6"
  ],
  "updated_date": "2026-09-02",
  "mechanism": "property tax circuit breaker program, extended to renters"
}
