{
  "candidate": "lisa-nee",
  "topic": "permitting-reform",
  "stance": "supports",
  "summary": "Supports expediting the permit process for housing development to prevent losing developers to other cities.",
  "citations": [
    "2026-07-29-wttw-news-chicago-mayoral-candidate-lisa-nee-on-affordable-housing-fiscal-respon#0"
  ],
  "updated_date": "2026-09-02",
  "mechanism": null
}
