{
  "candidate": "brandon-johnson",
  "topic": "social-housing",
  "stance": "supports",
  "summary": "Will create a Chicago Social Housing Pilot Program for mixed-income housing capped at 30% of income.",
  "citations": [
    "2026-07-09-brandon-johnson-for-chicago-affordable-housing#13"
  ],
  "updated_date": "2026-07-09",
  "mechanism": "Chicago Social Housing Pilot Program"
}
