{
  "candidate": "susana-mendoza",
  "topic": "property-taxes-tif",
  "stance": "no-position",
  "summary": "The speaker criticizes Mendoza as clueless about TIFs and property taxes, but no direct statement from Mendoza is given.",
  "citations": [
    "2026-07-23-the-ben-joravsky-show-oh-what-a-week-pappas-and-the-property-tax#2"
  ],
  "updated_date": "2026-07-23"
}
