{
  "candidate": "mike-quigley",
  "topic": "affordable-housing-funding",
  "stance": "supports-with-conditions",
  "summary": "Supports an abundant supply of housing as a minimum standard, but links it to first tackling the city's budget crisis.",
  "citations": [
    "2026-07-09-quigley-for-chicago-it-s-all-in-the-budget#0"
  ],
  "updated_date": "2026-07-09",
  "mechanism": null
}
