{
  "candidate": "brandon-johnson",
  "topic": "permitting-reform",
  "stance": "supports",
  "summary": "Will instruct buildings department to review regulatory changes to reduce costs.",
  "citations": [
    "2026-07-09-brandon-johnson-for-chicago-affordable-housing#15"
  ],
  "updated_date": "2026-07-09",
  "mechanism": "review regulatory changes"
}
