{
  "candidate": "alexi-giannoulias",
  "topic": "zoning-reform",
  "stance": "supports",
  "summary": "Supports reducing building code requirements to lower housing costs.",
  "citations": [
    "2026-08-02-the-fran-spielman-show-alexi-giannoulias#0"
  ],
  "updated_date": "2026-09-01",
  "mechanism": "reduce requirement for two stairways in buildings three stories or more; establish pre-approved architectural plans"
}
