{
  "candidate": "maria-pappas",
  "topic": "property-taxes-tif",
  "stance": "supports",
  "summary": "Issued a report highlighting that property taxes have outpaced inflation and wage growth, driven by TIF districts, and argues property taxes are too high.",
  "citations": [
    "2026-07-23-the-ben-joravsky-show-oh-what-a-week-pappas-and-the-property-tax#0"
  ],
  "updated_date": "2026-07-23"
}
