{
  "candidate": "toni-brooks",
  "topic": "affordable-housing-funding",
  "stance": "supports",
  "summary": "Proposes reallocating funds from 'ghost vacancies' to provide housing credits for renters.",
  "citations": [
    "2026-07-09-toni-brooks-for-mayor-platforms#1"
  ],
  "updated_date": "2026-07-09",
  "mechanism": "matching housing credit"
}
